{
  "schemaVersion": 2,
  "manifestRevision": "s02-s10-clay-r2-001",
  "sourceCommit": "c3210fa18bae0483e5302518d4426edb898a25fd",
  "assets": [
    {
      "runtimeProfile": "three-0.185.1-webgl",
      "extensionsRequired": [],
      "decoderIds": [],
      "clips": [
        {
          "name": "celebrate",
          "durationSeconds": 4,
          "rootMotion": "unknown"
        },
        {
          "name": "curious",
          "durationSeconds": 4,
          "rootMotion": "unknown"
        },
        {
          "name": "greet",
          "durationSeconds": 4,
          "rootMotion": "unknown"
        },
        {
          "name": "idle",
          "durationSeconds": 4,
          "rootMotion": "unknown"
        },
        {
          "name": "move",
          "durationSeconds": 4,
          "rootMotion": "unknown"
        },
        {
          "name": "rest",
          "durationSeconds": 4,
          "rootMotion": "unknown"
        },
        {
          "name": "special",
          "durationSeconds": 4,
          "rootMotion": "unknown"
        }
      ],
      "decorative": true,
      "containsText": false,
      "pointerPolicy": "inert",
      "measurement": {
        "status": "unmeasured",
        "encodedBytes": null,
        "drawCalls": null,
        "gpuBytes": null,
        "decodeMs": null,
        "environment": null
      },
      "id": "moa-bear-lite",
      "kind": "character",
      "revision": "v007",
      "status": "review",
      "companionSpecies": "bear",
      "provenance": {
        "sourceAssetId": "COMPANION-R2-001",
        "sourceHash": "7960a83fc11ffb57943227172caebe0dbabbd78a84f302d69df50e8ddcbc4874",
        "owner": "emotigom",
        "rightsBasis": "Issue #242 human use-scope decision",
        "reviewReference": "https://github.com/AI-HealthCare-05/AH_05_07/issues/242"
      },
      "delivery": {
        "url": "https://sk7-companion.gkrry.com/companion/v1/bear/v007/lite.glb",
        "objectKey": "companion/v1/bear/v007/lite.glb",
        "sha256": "7960a83fc11ffb57943227172caebe0dbabbd78a84f302d69df50e8ddcbc4874",
        "byteLength": 518636,
        "mime": "model/gltf-binary"
      }
    },
    {
      "runtimeProfile": "three-0.185.1-webgl",
      "extensionsRequired": [],
      "decoderIds": [],
      "clips": [
        {
          "name": "celebrate",
          "durationSeconds": 4,
          "rootMotion": "unknown"
        },
        {
          "name": "curious",
          "durationSeconds": 4,
          "rootMotion": "unknown"
        },
        {
          "name": "greet",
          "durationSeconds": 4,
          "rootMotion": "unknown"
        },
        {
          "name": "idle",
          "durationSeconds": 4,
          "rootMotion": "unknown"
        },
        {
          "name": "move",
          "durationSeconds": 4,
          "rootMotion": "unknown"
        },
        {
          "name": "rest",
          "durationSeconds": 4,
          "rootMotion": "unknown"
        },
        {
          "name": "special",
          "durationSeconds": 4,
          "rootMotion": "unknown"
        }
      ],
      "decorative": true,
      "containsText": false,
      "pointerPolicy": "inert",
      "measurement": {
        "status": "unmeasured",
        "encodedBytes": null,
        "drawCalls": null,
        "gpuBytes": null,
        "decodeMs": null,
        "environment": null
      },
      "id": "moa-rabbit-lite",
      "kind": "character",
      "revision": "v002",
      "status": "review",
      "companionSpecies": "rabbit",
      "provenance": {
        "sourceAssetId": "COMPANION-R2-003",
        "sourceHash": "b3559b2925bb16381adf954432e11541542c14bac7d6e6a52e7fa7f402825627",
        "owner": "emotigom",
        "rightsBasis": "Issue #242 human use-scope decision",
        "reviewReference": "https://github.com/AI-HealthCare-05/AH_05_07/issues/242"
      },
      "delivery": {
        "url": "https://sk7-companion.gkrry.com/companion/v1/rabbit/v002/lite.glb",
        "objectKey": "companion/v1/rabbit/v002/lite.glb",
        "sha256": "b3559b2925bb16381adf954432e11541542c14bac7d6e6a52e7fa7f402825627",
        "byteLength": 519456,
        "mime": "model/gltf-binary"
      }
    },
    {
      "runtimeProfile": "three-0.185.1-webgl",
      "extensionsRequired": [],
      "decoderIds": [],
      "clips": [
        {
          "name": "celebrate",
          "durationSeconds": 4,
          "rootMotion": "unknown"
        },
        {
          "name": "curious",
          "durationSeconds": 4,
          "rootMotion": "unknown"
        },
        {
          "name": "greet",
          "durationSeconds": 4,
          "rootMotion": "unknown"
        },
        {
          "name": "idle",
          "durationSeconds": 4,
          "rootMotion": "unknown"
        },
        {
          "name": "move",
          "durationSeconds": 4,
          "rootMotion": "unknown"
        },
        {
          "name": "rest",
          "durationSeconds": 4,
          "rootMotion": "unknown"
        },
        {
          "name": "special",
          "durationSeconds": 4,
          "rootMotion": "unknown"
        }
      ],
      "decorative": true,
      "containsText": false,
      "pointerPolicy": "inert",
      "measurement": {
        "status": "unmeasured",
        "encodedBytes": null,
        "drawCalls": null,
        "gpuBytes": null,
        "decodeMs": null,
        "environment": null
      },
      "id": "moa-cat-lite",
      "kind": "character",
      "revision": "v002",
      "status": "review",
      "companionSpecies": "cat",
      "provenance": {
        "sourceAssetId": "COMPANION-R2-005",
        "sourceHash": "6a77bf8229d43f7094208143cb611bdbb46ffd185faf769efc5114d37e3ed960",
        "owner": "emotigom",
        "rightsBasis": "Issue #242 human use-scope decision",
        "reviewReference": "https://github.com/AI-HealthCare-05/AH_05_07/issues/242"
      },
      "delivery": {
        "url": "https://sk7-companion.gkrry.com/companion/v1/cat/v002/lite.glb",
        "objectKey": "companion/v1/cat/v002/lite.glb",
        "sha256": "6a77bf8229d43f7094208143cb611bdbb46ffd185faf769efc5114d37e3ed960",
        "byteLength": 528348,
        "mime": "model/gltf-binary"
      }
    },
    {
      "runtimeProfile": "three-0.185.1-webgl",
      "extensionsRequired": [],
      "decoderIds": [],
      "clips": [
        {
          "name": "celebrate",
          "durationSeconds": 4,
          "rootMotion": "unknown"
        },
        {
          "name": "curious",
          "durationSeconds": 4,
          "rootMotion": "unknown"
        },
        {
          "name": "greet",
          "durationSeconds": 4,
          "rootMotion": "unknown"
        },
        {
          "name": "idle",
          "durationSeconds": 4,
          "rootMotion": "unknown"
        },
        {
          "name": "move",
          "durationSeconds": 4,
          "rootMotion": "unknown"
        },
        {
          "name": "rest",
          "durationSeconds": 4,
          "rootMotion": "unknown"
        },
        {
          "name": "special",
          "durationSeconds": 4,
          "rootMotion": "unknown"
        }
      ],
      "decorative": true,
      "containsText": false,
      "pointerPolicy": "inert",
      "measurement": {
        "status": "unmeasured",
        "encodedBytes": null,
        "drawCalls": null,
        "gpuBytes": null,
        "decodeMs": null,
        "environment": null
      },
      "id": "moa-dog-lite",
      "kind": "character",
      "revision": "v001",
      "status": "review",
      "companionSpecies": "dog",
      "provenance": {
        "sourceAssetId": "COMPANION-R2-007",
        "sourceHash": "71762e0e00be1dd083fc0421533519921f0ac0c427fc08246632606406e92884",
        "owner": "emotigom",
        "rightsBasis": "Issue #242 human use-scope decision",
        "reviewReference": "https://github.com/AI-HealthCare-05/AH_05_07/issues/242"
      },
      "delivery": {
        "url": "https://sk7-companion.gkrry.com/companion/v1/dog/v001/lite.glb",
        "objectKey": "companion/v1/dog/v001/lite.glb",
        "sha256": "71762e0e00be1dd083fc0421533519921f0ac0c427fc08246632606406e92884",
        "byteLength": 518128,
        "mime": "model/gltf-binary"
      }
    },
    {
      "runtimeProfile": "three-0.185.1-webgl",
      "extensionsRequired": [],
      "decoderIds": [],
      "clips": [
        {
          "name": "celebrate",
          "durationSeconds": 4,
          "rootMotion": "unknown"
        },
        {
          "name": "curious",
          "durationSeconds": 4,
          "rootMotion": "unknown"
        },
        {
          "name": "greet",
          "durationSeconds": 4,
          "rootMotion": "unknown"
        },
        {
          "name": "idle",
          "durationSeconds": 4,
          "rootMotion": "unknown"
        },
        {
          "name": "move",
          "durationSeconds": 4,
          "rootMotion": "unknown"
        },
        {
          "name": "rest",
          "durationSeconds": 4,
          "rootMotion": "unknown"
        },
        {
          "name": "special",
          "durationSeconds": 4,
          "rootMotion": "unknown"
        }
      ],
      "decorative": true,
      "containsText": false,
      "pointerPolicy": "inert",
      "measurement": {
        "status": "unmeasured",
        "encodedBytes": null,
        "drawCalls": null,
        "gpuBytes": null,
        "decodeMs": null,
        "environment": null
      },
      "id": "moa-red_panda-lite",
      "kind": "character",
      "revision": "v003",
      "status": "review",
      "companionSpecies": "red_panda",
      "provenance": {
        "sourceAssetId": "COMPANION-R2-009",
        "sourceHash": "a6de102411b17295b2a9ea9a88592b4e4e9d4f3d8af73101f906f669ef927b48",
        "owner": "emotigom",
        "rightsBasis": "Issue #242 human use-scope decision",
        "reviewReference": "https://github.com/AI-HealthCare-05/AH_05_07/issues/242"
      },